ICD-9,Description,ICD-10,Description,,,
674.22,"Disruption of perineal wound, delivered, with mention of postpartum complication",O90.1,Disruption of perineal obstetric wound,,,
674.24,"Disruption of perineal wound, postpartum condition or complication",,,,,
674.32,"Other complications of obstetrical surgical wounds, delivered, with mention of postpartum complication",O90.2,Hematoma of obstetric wound,,,
674.52,"Peripartum cardiomyopathy, delivered, with mention of postpartum condition",O90.3,Cardiomyopathy in the puerperium,,,
674.54,"Peripartum cardiomyopathy, postpartum condition or complication",,,,,
669.32,"Acute kidney failure following labor and delivery, delivered, with mention of postpartum complication",O90.4,Postpartum acute renal failure,,,
669.34,"Acute kidney failure following labor and delivery, postpartum condition or complication",,,,,
648.12,"Thyroid dysfunction of mother, delivered, with mention of postpartum complication",O90.5,Postpartum thyroiditis,,,
648.14,"Thyroid dysfunction of mother, postpartum condition or complication",,,,,
,,O90.8,"Other complications of the puerperium, not elsewhere classi?ed",,,
674.92,"Unspecified complications of puerperium, delivered, with mention of postpartum complication",O90.9,"Complication of the puerperium, unspeci?ed",,,
674.94,"Unspecified complications of puerperium, postpartum condition or complication",,,,,
675,Infections of the brest and nipple associated with childbirth,O91,Infections of breast associated with childbirth,,,
675,Infections of the brest and nipple associated with childbirth,O91.0,Infection of nipple associated with childbirth,,,
675.1-,Abcess of breast associated with childbirth,O91.1,Abscess of breast associated with childbirth,,,
675.2-,Nonpurulent mastitis associated with childbirth,O91.2,Nonpurulent mastitis associated with childbirth,,,
676,Other disorders of the breast associated with childbirth and disorders of lactation,O92,Other disorders of breast and lactation associated with childbirth,,,
676.0-,Retracted nipple associated with childbirth,O92.0,Retracted nipple associated with childbirth,,,
676.1-,Cracked nipple associated with childbirth,O92.1,Cracked nipple,,,
676.3-,Other and unspecified disorder of breast associated with childbirth,O92.2,Other and unspeci?ed disorders of breast associated with childbirth,,,
676.42,"Failure of lactation, delivered, with mention of postpartum complication",O92.3,Agalactia,,,
676.44,"Failure of lactation, postpartum condition or complciation",,,,,
676.84,"Other disorders of lactation, postpartum condition or complication",O92.4,Hypogalactia,,,
676.52,"Suppressed lactation, delivered, with mention of postpartum complication",O92.5,Suppressed lactation,,,
676.54,"Suppressed lactation, postpartum condition or complication",,,,,
676.62,"Galactorrhea associated with childbirth, delivered, with mention of postpartum complication",O92.6,Galactorrhea,,,
676.64,"Galactorrhea associated with childbirth, postpartum condition or complication",,,,,
,,O92.7,Other and unspeci?ed disorders of lactation,,,
"Other obstetric conditions, not elsewhere classi?ed (O95–O99)",,,,,,
,,O95,Obstetric death of unspeci?ed cause,,,
,,O96,Death from any obstetric cause occurring more than 42 days but less than 1 year after delivery,,,
,,O96.0,Death from direct obstetric cause occurring more than 42 days but less than 1 year after delivery,,,
,,O96.1,Death from indirect obstetric cause occurring more than 42 days but less than 1 year after delivery,,,
,,O96.9,Death from unspeci?ed obstetric cause occurring more than 42 days but less than 1 year after delivery,,,
,,O97,Death from sequelae of direct obstetric causes,,,
,,O97.0,Death from sequelae of direct obstetric cause,,,
,,O97.1,Death from sequelae of indirect obstetric cause,,,
,,O97.9,"Death from sequelae of obstetric cause, unspeci?ed",,,
760.2,Maternal infections affecting fetus or newborn,O98,"Maternal infectious and parasitic diseases classi?able elsewhere but complicating pregnancy,childbirth, and the puerperium",,,
647.3,Tuberculosis complicating pregnancy childbirth or the puerperium,O98.0,"Tuberculosis complicating pregnancy, childbirth, and the puerperium",,,
647,Syphilis complicating pregnancy childbirth or the puerperium,O98.1,"Syphilis complicating pregnancy, childbirth, and the puerperium",,,
647.1,Gonorrhea complicating pregnancy childbirth or the puerperium,O98.2,"Gonorrhea complicating pregnancy, childbirth, and the puerperium",,,
647.9,Unspecified infection or infestation complicating pregnancy childbirth or the puerperium,O98.3,"Other infections with a predominantly sexual mode of transmission complicating pregnancy, childbirth, and the puerperium",,,
,,O98.4,"Viral hepatitis complicating pregnancy, childbirth, and the puerperium",,,
647.6,Other viral diseases complicating pregnancy childbirth or the puerperium,O98.5,"Other viral diseases complicating pregnancy, childbirth, and the puerperium",,,
,,O98.6,"Protozoal diseases complicating pregnancy, childbirth, and the puerperium",,,
,,O98.7,"Human immunode?ciency (HIV) disease complicating pregnancy, childbirth, and the puerperium",,,
647.8,Other specified infectious and parasitic diseases complicating pregnancy childbirth or the puerperium,O98.8,"Other maternal infectious and parasitic diseases complicating pregnancy, childbirth, and the puerperium",,,
647.9,Unspecified infection or infestation complicating pregnancy childbirth or the puerperium,O98.9,"Unspeci?ed maternal infectious or parasitic disease complicating pregnancy, childbirth, and the puerperium",,,
,,O99,"Other maternal diseases classi?able elsewhere but complicating pregnancy, childbirth, and the puerperium",,,
648.2,Anemia complicating pregnancy childbirth or the puerperium,O99.0,"Anemia complicating pregnancy, childbirth, and the puerperium",,,
,,O99.1,Other diseases of the blood and blood-forming organs and certain disorders involving the immune mechanism,,,
,,O99.2,"Endocrine, nutritional, and metabolic diseases complicating pregnancy, childbirth, and the puerperium",,,
648.4,Mental disorders complicating pregnancy childbirth or the puerperium,O99.3,"Mental disorders and diseases of the nervous system complicating pregnancy, childbirth, and the puerperium",,,
760.3,Other chronic maternal circulatory and respiratory diseases affecting fetus or newborn,O99.4,"Diseases of the circulatory system complicating pregnancy, childbirth, and the puerperium",,,
760.3,Other chronic maternal circulatory and respiratory diseases affecting fetus or newborn,O99.5,"Diseases of the respiratory system complicating pregnancy, childbirth, and the puerperium",,,
,,O99.6,"Diseases of the digestive system complicating pregnancy, childbirth, and the puerperium",,,
,,O99.7,"Diseases of the skin and subcutaneous tissue complicating pregnancy, childbirth, and the puerperium",,,
,,O99.8,"Other speci?ed diseases and conditions complicating pregnancy, childbirth, and the puerperium",,,
,,,,,,
,,,,,,
,,"HELLP = hemolysis, elevated liver enzymes, low platelet count; ICD-10 = International Classi?cation of Diseases, 10th Revision; NOS = not otherwise speci?ed.",,,,
,,,,,,
,,,,,,
,,* From references 18 and 21.,,,,
